title,speaker,speech,POLARITY,SENSITIVITY#enthusiasm,INTROSPECTION,INTROSPECTION#ecstasy,INTROSPECTION#rage,ATTITUDE#delight,INTROSPECTION#joy,TEMPER,INTROSPECTION#terror,SENSITIVITY,INTROSPECTION#contentment,INTROSPECTION#loathing,INTROSPECTION#dislike,ATTITUDE,TEMPER#serenity,INTROSPECTION#fear,SENSITIVITY#anger,SENSITIVITY#loathing,ATTITUDE#serenity,TEMPER#bliss,ATTITUDE#pleasantness,ATTITUDE#acceptance,ATTITUDE#loathing,INTROSPECTION#anxiety,SENSITIVITY#responsiveness,INTROSPECTION#disgust,ATTITUDE#rage,TEMPER#terror,TEMPER#fear,SENSITIVITY#sadness,SENSITIVITY#eagerness,SENSITIVITY#annoyance,TEMPER#calmness,SENSITIVITY#anxiety,SENSITIVITY#dislike,INTROSPECTION#sadness,SENSITIVITY#grief,SENSITIVITY#acceptance,ATTITUDE#anger
m39,PAMELA/PHONE,If you ever want to make it to five you're gonna listen to me real close. Jason Bourne is armed and extremely dangerous. A week ago he assassinated two men in Berlin one of whom was a highly-experienced field officer... ,-0.015249999999999972,0.0,0.0,0.931,0.0,0.9335,0.0,0.0,0.0,-0.504,0.0,-0.4805,0.0,-0.838,0.272,0.0,0.0,-0.843,0.0,0.0,0.0,0.0,0.0,0.0,0.0,0.0,0.0,0.0,0.0,0.0,0.0,0.0,0.0,0.0,0.0,0.0,0.0,0.0,0.0
m39,NEVINS/PHONE,Me? Four years.,0.0,0.0,0.0,0.0,0.0,0.0,0.0,0.0,0.0,0.0,0.0,0.0,0.0,0.0,0.0,0.0,0.0,0.0,0.0,0.0,0.0,0.0,0.0,0.0,0.0,0.0,0.0,0.0,0.0,0.0,0.0,0.0,0.0,0.0,0.0,0.0,0.0,0.0,0.0
m39,PAMELA/PHONE,How long have you worked for the agency?,0.7655,0.0,0.0,0.896,0.0,0.0,0.0,0.0,0.0,0.0,0.0,0.0,0.0,0.0,0.0,0.0,0.0,0.0,0.0,0.0,0.0,0.0,0.0,0.0,0.0,0.0,0.0,0.0,0.0,0.0,0.0,0.0,0.0,0.0,0.0,0.0,0.0,0.0,0.0
m39,PAMELA/PHONE,Pamela Landy again. Where do we stand?,0.6583333333333333,0.965,0.0,0.856,0.0,0.0,0.0,0.0,0.0,0.0,0.0,0.0,0.0,0.0,0.265,0.0,0.0,0.0,0.0,0.0,0.0,0.0,0.0,0.0,0.0,0.0,0.0,0.0,0.0,0.0,0.0,0.0,0.0,0.0,0.0,0.0,0.0,0.0,0.0
m39,NEVINS/PHONE,Who's this?,0.0,0.0,0.0,0.0,0.0,0.0,0.0,0.0,0.0,0.0,0.0,0.0,0.0,0.0,0.0,0.0,0.0,0.0,0.0,0.0,0.0,0.0,0.0,0.0,0.0,0.0,0.0,0.0,0.0,0.0,0.0,0.0,0.0,0.0,0.0,0.0,0.0,0.0,0.0
m39,PAMELA/PHONE,Mr. Nevins?,0.0,0.0,0.0,0.0,0.0,0.0,0.0,0.0,0.0,0.0,0.0,0.0,0.0,0.0,0.0,0.0,0.0,0.0,0.0,0.0,0.0,0.0,0.0,0.0,0.0,0.0,0.0,0.0,0.0,0.0,0.0,0.0,0.0,0.0,0.0,0.0,0.0,0.0,0.0
m39,PAMELA,Felt promising. It's a start.,-0.874,0.0,0.0,0.0,0.0,0.0,0.0,0.0,0.0,0.0,0.0,-0.926,0.0,0.0,0.0,0.0,0.0,-0.98,0.0,0.0,0.0,0.0,0.0,0.0,0.0,0.0,0.0,0.0,0.0,0.0,0.0,0.0,0.0,0.0,0.0,0.0,0.0,0.0,0.0
m39,NICKY,So?,0.0,0.0,0.0,0.0,0.0,0.0,0.0,0.0,0.0,0.0,0.0,0.0,0.0,0.0,0.0,0.0,0.0,0.0,0.0,0.0,0.0,0.0,0.0,0.0,0.0,0.0,0.0,0.0,0.0,0.0,0.0,0.0,0.0,0.0,0.0,0.0,0.0,0.0,0.0
m39,PAMELA,Let's give him half an hour.,-0.959,0.0,0.0,0.0,0.0,0.0,0.0,-0.959,0.0,0.0,0.0,0.0,0.0,0.0,0.0,0.0,0.0,0.0,0.0,0.0,0.0,0.0,0.0,0.0,0.0,0.0,0.0,0.0,0.0,0.0,0.0,0.0,0.0,0.0,0.0,0.0,0.0,0.0,0.0
m39,PAMELA,Alright...,0.726,0.0,0.0,0.96,0.0,0.0,0.0,0.0,0.0,0.0,0.0,0.0,0.0,0.0,0.0,0.0,0.0,0.0,0.0,0.0,0.0,0.0,0.0,0.0,0.0,0.0,0.0,0.0,0.0,0.0,0.0,0.0,0.0,0.0,0.0,0.0,0.0,0.0,0.0
m39,NICKY,I don't know. He was sick. He wanted out. I believed him.,0.1865,0.0,0.0,0.0,0.0,0.0,0.0,0.0,0.0,0.0,0.0,0.0,0.0,0.0,0.0,-0.614,0.0,0.0,0.0,0.914,0.0,0.0,0.0,0.0,0.0,0.0,0.0,0.0,0.0,0.0,0.0,0.0,0.0,0.0,0.0,0.0,0.0,0.0,0.0
m39,PAMELA,What do you think? Is he coming in?,-0.009500000000000008,0.0,0.0,0.996,0.0,0.0,0.0,0.0,0.0,0.0,0.0,0.0,0.0,0.0,0.0,0.0,0.0,-0.995,0.0,0.0,0.0,0.0,0.0,0.0,0.0,0.0,0.0,0.0,0.0,0.0,0.0,0.0,0.0,0.0,0.0,0.0,0.0,0.0,0.0
m39,NICKY,It's got caffeine in it. That's all I know.,0.843,0.0,0.0,0.942,0.0,0.0,0.0,0.0,0.0,0.0,0.0,0.0,0.0,0.0,0.0,0.0,0.0,0.0,0.0,0.0,0.0,0.0,0.0,0.0,0.0,0.0,0.0,0.0,0.0,0.0,0.0,0.0,0.0,0.0,0.0,0.0,0.0,0.0,0.0
m39,PAMELA,Is it fresh?,0.823,0.0,0.0,0.83,0.0,0.0,0.0,0.0,0.0,0.0,0.0,0.0,0.0,0.0,0.0,0.0,0.0,0.0,0.0,0.0,0.0,0.0,0.0,0.0,0.0,0.0,0.0,0.0,0.0,0.0,0.0,0.0,0.0,0.0,0.0,0.0,0.0,0.0,0.0
m39,NICKY,Because he's doing just what he said he'd do. He's coming for us.,0.035499999999999976,0.0,0.0,0.996,0.0,0.0,0.0,0.0,0.0,0.0,0.0,-0.826,0.0,0.0,0.0,0.0,0.0,0.0,0.0,0.0,0.0,0.0,0.0,0.0,0.0,0.0,0.0,0.0,0.0,0.0,0.0,0.0,0.0,0.0,0.0,0.0,0.0,0.0,0.0
m39,PAMELA,And why is that?,0.0,0.0,0.0,0.0,0.0,0.0,0.0,0.0,0.0,0.0,0.0,0.0,0.0,0.0,0.0,0.0,0.0,0.0,0.0,0.0,0.0,0.0,0.0,0.0,0.0,0.0,0.0,0.0,0.0,0.0,0.0,0.0,0.0,0.0,0.0,0.0,0.0,0.0,0.0
m39,NICKY,I don't think we need to keep looking for him anyway.,-0.554,0.0,0.0,0.0,0.0,0.0,0.0,-0.212,0.0,0.0,0.0,0.0,0.0,0.0,0.0,0.0,0.0,-0.995,0.0,0.0,0.0,0.0,0.0,0.0,0.0,0.0,0.0,0.0,0.0,0.0,0.0,0.0,0.0,0.0,0.0,0.0,0.0,0.0,0.0
m39,PAMELA,See that's a problem for me Nicky. Whatever he's doing we need to end it. This isn't the kind of mess you walk away from.,-0.20142857142857143,0.0,0.0,0.0,0.0,0.0,0.0,-0.212,0.0,0.0,0.0,-0.8855,0.0,-0.321,0.0,0.0,0.0,0.0,0.0,0.0,0.659,0.0,0.0,0.0,0.0,0.0,0.0,0.0,-0.567,0.0,0.0,0.0,0.0,0.0,0.0,0.0,0.0,0.0,0.0
m39,NICKY,What do you want from me? I was reassigned. I'm out.,0.173,0.0,0.0,0.0,0.0,0.0,0.0,0.0,0.0,0.0,0.0,0.0,0.0,0.0,0.206,0.0,0.0,0.0,0.0,0.0,0.0,0.0,0.0,0.0,0.0,0.0,0.0,0.0,0.0,0.0,0.0,0.0,0.0,0.0,0.0,0.0,0.0,0.0,0.0
m39,PAMELA,Some women like Dobermans --,0.268,0.0,0.0,0.0,0.0,0.0,0.0,0.0,0.0,0.0,0.0,0.0,0.0,0.0,0.0,0.0,0.0,0.0,0.0,0.0,0.0,0.0,0.0,0.0,0.268,0.0,0.0,0.0,0.0,0.0,0.0,0.0,0.0,0.0,0.0,0.0,0.0,0.0,0.0
m39,NICKY,These were killers. Conklin had them all jacked up. They were Dobermans.,-0.37466666666666665,0.0,0.0,0.0,0.0,0.0,0.0,0.0,0.0,0.0,0.0,-0.943,0.0,0.0,0.0,0.0,-0.618,0.0,0.0,0.0,0.0,0.0,0.0,0.0,0.268,0.0,0.0,0.0,0.0,0.0,0.0,0.0,0.0,0.0,0.0,0.0,0.0,0.0,0.0
m39,PAMELA,Did you?,0.0,0.0,0.0,0.0,0.0,0.0,0.0,0.0,0.0,0.0,0.0,0.0,0.0,0.0,0.0,0.0,0.0,0.0,0.0,0.0,0.0,0.0,0.0,0.0,0.0,0.0,0.0,0.0,0.0,0.0,0.0,0.0,0.0,0.0,0.0,0.0,0.0,0.0,0.0
m39,NICKY,You mean did I want a date?,0.0,0.0,0.0,0.0,0.0,0.0,0.0,0.0,0.0,0.0,0.0,0.0,0.0,0.0,0.0,0.0,0.0,0.0,0.0,0.0,0.0,0.0,0.0,0.0,0.0,0.0,0.0,0.0,0.0,0.0,0.0,0.0,0.0,0.0,0.0,0.0,0.0,0.0,0.0
m39,PAMELA,You felt nothing? No spark? Two young people in Paris? Dangerous missions? Life and death?,0.03600000000000002,0.0,0.0,0.8725,0.0,0.0,0.659,0.0,0.0,-0.908,0.0,0.0,0.0,-0.311,0.0,0.0,0.0,-0.9115,0.0,0.942,0.0,0.0,0.0,0.0,0.0,0.0,0.0,0.0,0.0,0.0,0.0,0.0,0.0,0.0,0.0,0.0,0.0,0.0,0.0
m39,NICKY,You're making it out like we're friends here or something. I met him alone twice.,0.21100000000000002,0.0,-0.1185,0.0,0.0,0.0,0.0,0.0,0.0,0.0,0.0,0.0,0.0,0.0,0.0,0.0,0.0,0.0,0.0,0.0,0.659,0.0,0.0,0.0,0.0,0.0,0.0,0.0,0.0,0.0,0.0,0.0,0.0,0.0,0.0,0.0,0.0,0.0,0.0
m39,PAMELA,Not good enough. You're the person who floated this amnesia story.  Ever feel sorry for him? For what he'd been through?,0.23960000000000004,0.971,0.0,0.0,0.0,0.0,0.0,0.0,0.0,0.0,0.0,0.0,0.0,0.0,0.0,-0.843,0.0,0.0,0.0,0.919,0.659,0.0,0.0,0.0,0.0,-0.855,0.0,0.0,0.0,0.0,0.0,0.0,0.0,0.0,0.0,0.0,0.0,0.0,0.0
m39,NICKY,If you say so.,0.0,0.0,0.0,0.0,0.0,0.0,0.0,0.0,0.0,0.0,0.0,0.0,0.0,0.0,0.0,0.0,0.0,0.0,0.0,0.0,0.0,0.0,0.0,0.0,0.0,0.0,0.0,0.0,0.0,0.0,0.0,0.0,0.0,0.0,0.0,0.0,0.0,0.0,0.0
m39,PAMELA,So he fooled you.,-0.329,0.0,0.0,0.0,0.0,0.0,0.0,0.0,0.0,0.0,0.0,0.0,0.0,-0.329,0.0,0.0,0.0,0.0,0.0,0.0,0.0,0.0,0.0,0.0,0.0,0.0,0.0,0.0,0.0,0.0,0.0,0.0,0.0,0.0,0.0,0.0,0.0,0.0,0.0
m39,NICKY,I believed Jason Bourne had suffered a severe traumatic breakdown.,-0.29359999999999997,0.0,0.0,0.0,0.0,0.0,0.0,0.0,0.0,0.0,0.0,0.0,0.0,0.0,0.0,-0.38800000000000007,0.0,0.0,0.0,0.914,0.0,0.0,0.0,0.0,0.0,0.0,0.0,0.0,0.0,0.0,0.0,0.0,0.0,0.0,-0.623,0.0,-0.998,0.0,0.0
m39,PAMELA,Believed what?,0.914,0.0,0.0,0.0,0.0,0.0,0.0,0.0,0.0,0.0,0.0,0.0,0.0,0.0,0.0,0.0,0.0,0.0,0.0,0.914,0.0,0.0,0.0,0.0,0.0,0.0,0.0,0.0,0.0,0.0,0.0,0.0,0.0,0.0,0.0,0.0,0.0,0.0,0.0
m39,NICKY,Look what do you want me to say? I was there. I believed him.,0.914,0.0,0.0,0.0,0.0,0.0,0.0,0.0,0.0,0.0,0.0,0.0,0.0,0.0,0.0,0.0,0.0,0.0,0.0,0.914,0.0,0.0,0.0,0.0,0.0,0.0,0.0,0.0,0.0,0.0,0.0,0.0,0.0,0.0,0.0,0.0,0.0,0.0,0.0
m39,PAMELA,Are you an expert in amnesia?,0.9055,0.919,0.0,0.0,0.0,0.0,0.0,0.0,0.0,0.0,0.0,0.0,0.0,0.0,0.0,0.0,0.0,0.0,0.0,0.0,0.0,0.0,0.0,0.0,0.0,0.0,0.0,0.0,0.0,0.0,0.0,0.0,0.0,0.0,0.0,0.0,0.0,0.0,0.0
m39,NICKY,Am I a doctor no but...,0.0,0.0,0.0,0.0,0.0,0.0,0.0,0.0,0.0,0.0,0.0,0.0,0.0,0.0,0.0,0.0,0.0,0.0,0.0,0.0,0.0,0.0,0.0,0.0,0.0,0.0,0.0,0.0,0.0,0.0,0.0,0.0,0.0,0.0,0.0,0.0,0.0,0.0,0.0
m39,PAMELA,I'm curious about Bourne. Your interpretation of his condition. You have specific training in the identification and diagnosis of psychological conditions?,0.2957142857142857,0.0,0.0,0.8925,0.0,0.0,0.0,0.0,0.0,0.0,0.0,-0.987,0.0,0.0,0.0,0.0,0.0,0.0,0.0,0.0,0.0,0.0,0.0,0.0,0.0,0.0,0.0,0.0,0.0,0.0,0.576,0.0,0.0,0.0,0.0,0.0,0.0,0.0,0.0
m39,PAMELA,You were his local contact. You were with him the night Conklin died. You're coming with us.,-0.01150000000000001,0.0,0.0,0.996,0.0,0.0,0.0,0.0,-0.984,0.0,0.0,0.0,0.0,0.0,0.0,0.0,0.0,0.0,0.0,0.0,0.0,0.0,0.0,0.0,0.0,0.0,0.0,0.0,0.0,0.0,0.0,0.0,0.0,0.0,0.0,0.0,0.0,0.0,0.0
m39,NICKY,Good luck.,0.7355,0.0,0.0,0.879,0.0,0.0,0.0,0.0,0.0,0.0,0.0,0.0,0.0,0.0,0.0,0.0,0.0,0.0,0.0,0.0,0.659,0.0,0.0,0.0,0.0,0.0,0.0,0.0,0.0,0.0,0.0,0.0,0.0,0.0,0.0,0.0,0.0,0.0,0.0
m39,NICKY,Before this? Before Bourne? No.,0.0,0.0,0.0,0.0,0.0,0.0,0.0,0.0,0.0,0.0,0.0,0.0,0.0,0.0,0.0,0.0,0.0,0.0,0.0,0.0,0.0,0.0,0.0,0.0,0.0,0.0,0.0,0.0,0.0,0.0,0.0,0.0,0.0,0.0,0.0,0.0,0.0,0.0,0.0
m39,PAMELA,Amnesia?,0.971,0.971,0.0,0.0,0.0,0.0,0.0,0.0,0.0,0.0,0.0,0.0,0.0,0.0,0.0,0.0,0.0,0.0,0.0,0.0,0.0,0.0,0.0,0.0,0.0,0.0,0.0,0.0,0.0,0.0,0.0,0.0,0.0,0.0,0.0,0.0,0.0,0.0,0.0
m39,NICKY,Depression. Anger. Compulsive behaviors. They had physical symptoms -- headaches -- sensitivity to light --,-0.176125,0.0,-0.438,0.842,0.0,0.0,0.659,-0.4475,-0.999,0.0,0.0,0.0,0.0,0.0,0.0,0.0,0.0,0.0,0.0,0.0,0.0,0.0,0.0,0.0,0.0,-0.878,0.0,0.0,0.0,0.0,0.558,0.0,0.0,0.0,0.0,0.0,0.0,0.0,0.0
m39,PAMELA,What kind of problems?,0.066,0.0,0.0,0.0,0.0,0.0,0.0,0.0,0.0,0.0,0.0,0.0,0.0,0.0,0.0,0.0,0.0,0.0,0.0,0.0,0.659,0.0,0.0,0.0,0.0,0.0,0.0,0.0,-0.567,0.0,0.0,0.0,0.0,0.0,0.0,0.0,0.0,0.0,0.0
m39,PAMELA,And what about you anything?,0.0,0.0,0.0,0.0,0.0,0.0,0.0,0.0,0.0,0.0,0.0,0.0,0.0,0.0,0.0,0.0,0.0,0.0,0.0,0.0,0.0,0.0,0.0,0.0,0.0,0.0,0.0,0.0,0.0,0.0,0.0,0.0,0.0,0.0,0.0,0.0,0.0,0.0,0.0
m39,TEDDY,Yes. In that order.,0.529,0.0,0.0,0.856,0.0,0.0,0.0,0.0,0.0,0.0,0.0,0.0,0.0,0.0,0.0,0.0,0.0,0.0,0.0,0.0,0.0,0.0,0.0,0.0,0.0,0.0,0.0,0.0,0.0,0.0,0.0,0.0,0.0,0.0,0.0,0.0,0.0,0.45,0.0
m39,PAMELA,Are we hacking or asking?,-0.851,0.0,0.0,0.0,-0.95,0.0,0.0,0.0,0.0,0.0,0.0,0.0,0.0,0.0,0.0,0.0,0.0,0.0,0.0,0.0,0.0,0.0,0.0,0.0,0.0,0.0,0.0,0.0,0.0,0.0,0.0,0.0,0.0,0.0,0.0,0.0,0.0,0.0,0.0
m39,TEDDY,We're looking at all Berlin outbound. Good news is every train station in Berlin has thirty to forty fixed digital security cameras. Common feed.,0.5571666666666667,0.874,0.0,0.9325,0.0,0.0,0.0,0.0,0.0,0.0,0.0,0.0,0.0,-0.278,0.0,0.0,0.0,0.0,0.0,0.0,0.659,0.329,0.0,0.0,0.0,0.0,0.0,0.0,0.0,0.0,0.0,0.0,0.0,0.0,0.0,0.0,0.0,0.0,0.0
m39,PAMELA,Alright... I want you Kurt and Kim to stay on Bourne track everything that's out there...,0.726,0.0,0.0,0.96,0.0,0.0,0.0,0.0,0.0,0.0,0.0,0.0,0.0,0.0,0.0,0.0,0.0,0.0,0.0,0.0,0.0,0.0,0.0,0.0,0.0,0.0,0.0,0.0,0.0,0.0,0.0,0.0,0.0,0.0,0.0,0.0,0.0,0.0,0.0
m39,TEDDY,His wife. In room 645. Then she shot herself. ,0.0,0.0,0.0,0.0,0.0,0.0,0.0,0.0,0.0,0.0,0.0,0.0,0.0,0.0,0.0,0.0,0.0,0.0,0.0,0.0,0.0,0.0,0.0,0.0,0.0,0.0,0.0,0.0,0.0,0.0,0.0,0.0,0.0,0.0,0.0,0.0,0.0,0.0,0.0
m39,PAMELA,By who?,0.0,0.0,0.0,0.0,0.0,0.0,0.0,0.0,0.0,0.0,0.0,0.0,0.0,0.0,0.0,0.0,0.0,0.0,0.0,0.0,0.0,0.0,0.0,0.0,0.0,0.0,0.0,0.0,0.0,0.0,0.0,0.0,0.0,0.0,0.0,0.0,0.0,0.0,0.0
m39,TEDDY,Here's what I've got.  Remember Vladimir Neski? Russian politician? Seven years ago he was due to speak to a group of European Oil ministers here at the hotel. He never did. He was murdered.,-0.15775,0.0,-0.4845,0.829,-0.847,0.0,0.0,0.0,0.0,0.0,0.0,0.0,0.0,0.0,0.0,0.0,0.0,0.0,0.0,0.0,0.0,0.329,0.0,0.0,0.0,0.0,0.0,0.0,0.0,0.0,0.0,0.0,0.0,0.0,0.0,0.0,0.0,0.0,0.0
m39,PAMELA,Yeah that'll work...What the hell was he doing here?,-0.17375,0.0,0.0,0.825,0.0,0.0,0.0,-0.846,0.0,0.0,0.0,-0.826,0.0,0.0,0.169,0.0,0.0,0.0,0.0,0.0,0.0,0.0,0.0,0.0,0.0,0.0,0.0,0.0,0.0,0.0,0.0,0.0,0.0,0.0,0.0,0.0,0.0,0.0,0.0
m39,TEDDY,Black coat possibly leather. Dark slacks. Dark t-shirt.  He says they're gonna try and corral the guests on the street over there and then check them out but...,-0.5544,0.0,0.0,0.0,0.0,0.0,0.0,0.0,0.0,0.0,0.0,0.0,0.0,0.0,0.291,0.0,0.0,-0.924,0.0,0.0,0.0,0.0,0.0,0.0,0.0,0.0,0.0,0.0,0.0,0.0,0.0,0.0,0.0,0.0,0.0,0.0,0.0,0.0,-0.538
m39,PAMELA,Are we locked up?,-0.379,0.0,0.0,0.0,0.0,0.0,0.0,0.0,0.0,0.0,0.0,0.0,0.0,0.0,0.0,0.0,0.0,0.0,0.0,0.0,0.0,0.0,0.0,0.0,0.0,0.0,0.0,0.0,0.0,0.0,0.0,0.0,0.0,0.0,-0.606,0.0,0.0,0.0,0.0
m39,TEDDY,No. Munich's a bust. He's loose.,-0.21100000000000002,0.0,0.0,0.0,0.0,0.0,0.0,0.0,0.0,0.0,0.0,0.0,0.0,-0.259,0.0,0.0,0.0,0.0,0.0,0.0,0.0,0.0,0.0,0.0,0.0,0.0,0.0,0.0,0.0,0.0,0.0,0.0,0.0,-0.163,0.0,0.0,0.0,0.0,0.0
m39,PAMELA,Anything?,0.0,0.0,0.0,0.0,0.0,0.0,0.0,0.0,0.0,0.0,0.0,0.0,0.0,0.0,0.0,0.0,0.0,0.0,0.0,0.0,0.0,0.0,0.0,0.0,0.0,0.0,0.0,0.0,0.0,0.0,0.0,0.0,0.0,0.0,0.0,0.0,0.0,0.0,0.0
m39,PAMELA,"What the hell is a """"Treadstone?""""""",-0.846,0.0,0.0,0.0,0.0,0.0,0.0,-0.846,0.0,0.0,0.0,0.0,0.0,0.0,0.0,0.0,0.0,0.0,0.0,0.0,0.0,0.0,0.0,0.0,0.0,0.0,0.0,0.0,0.0,0.0,0.0,0.0,0.0,0.0,0.0,0.0,0.0,0.0,0.0
m39,TEDDY,Yup...  The main word there the file heading translates as: Treadstone.,0.27666666666666667,0.0,0.0,0.849,0.0,0.0,0.0,0.0,0.0,0.0,0.0,0.0,0.0,-0.23,0.224,0.0,0.0,0.0,0.0,0.0,0.0,0.0,0.0,0.0,0.0,0.0,0.0,0.0,0.0,0.0,0.0,0.0,0.0,0.0,0.0,0.0,0.0,0.0,0.0
m39,PAMELA,Do we know what this says?,0.0,0.0,0.0,0.0,0.0,0.0,0.0,0.0,0.0,0.0,0.0,0.0,0.0,0.0,0.0,0.0,0.0,0.0,0.0,0.0,0.0,0.0,0.0,0.0,0.0,0.0,0.0,0.0,0.0,0.0,0.0,0.0,0.0,0.0,0.0,0.0,0.0,0.0,0.0
