title,speaker,speech,POLARITY,SENSITIVITY#enthusiasm,INTROSPECTION,INTROSPECTION#ecstasy,INTROSPECTION#rage,ATTITUDE#delight,INTROSPECTION#joy,TEMPER,INTROSPECTION#terror,SENSITIVITY,INTROSPECTION#contentment,INTROSPECTION#loathing,INTROSPECTION#dislike,ATTITUDE,TEMPER#serenity,INTROSPECTION#fear,SENSITIVITY#anger,SENSITIVITY#loathing,ATTITUDE#serenity,TEMPER#bliss,ATTITUDE#pleasantness,ATTITUDE#acceptance,ATTITUDE#loathing,INTROSPECTION#anxiety,SENSITIVITY#responsiveness,INTROSPECTION#disgust,ATTITUDE#rage,TEMPER#terror,TEMPER#fear,SENSITIVITY#sadness,SENSITIVITY#eagerness,SENSITIVITY#annoyance,TEMPER#calmness,SENSITIVITY#anxiety,SENSITIVITY#dislike,INTROSPECTION#sadness,SENSITIVITY#grief,SENSITIVITY#acceptance,ATTITUDE#anger
m39,GRETKOV,Bourne comes here? Why?,0.0,0.0,0.0,0.0,0.0,0.0,0.0,0.0,0.0,0.0,0.0,0.0,0.0,0.0,0.0,0.0,0.0,0.0,0.0,0.0,0.0,0.0,0.0,0.0,0.0,0.0,0.0,0.0,0.0,0.0,0.0,0.0,0.0,0.0,0.0,0.0,0.0,0.0,0.0
m39,ABBOTT,He left yesterday on the night train. He's probably just getting in now.  You'll have to hurry.,0.3056666666666667,0.917,0.0,0.878,-0.887,0.0,0.0,0.0,0.0,0.0,0.0,0.0,0.0,0.0,0.0,0.0,0.0,0.0,0.0,0.0,0.0,0.0,0.0,0.0,0.0,0.0,0.0,0.0,0.0,0.0,0.0,0.0,0.0,0.0,0.0,0.0,0.0,0.0,0.0
m39,GRETKOV,What?,0.0,0.0,0.0,0.0,0.0,0.0,0.0,0.0,0.0,0.0,0.0,0.0,0.0,0.0,0.0,0.0,0.0,0.0,0.0,0.0,0.0,0.0,0.0,0.0,0.0,0.0,0.0,0.0,0.0,0.0,0.0,0.0,0.0,0.0,0.0,0.0,0.0,0.0,0.0
m39,ABBOTT,Save it for Bourne.,0.714,0.0,0.0,0.0,0.0,0.948,0.0,0.0,0.0,0.0,0.0,0.0,0.0,0.0,0.0,0.0,0.0,0.0,0.0,0.0,0.0,0.0,0.0,0.0,0.0,0.0,0.0,0.0,0.0,0.0,0.0,0.0,0.0,0.0,0.0,0.0,0.0,0.0,0.0
m39,GRETKOV,Go to the airport. Get a plane. I'll have a brass band waiting for you.,-0.046249999999999986,0.0,-0.863,0.878,0.0,0.0,0.659,0.0,0.0,-0.826,0.0,0.0,0.0,0.0,0.0,0.0,0.0,0.0,0.0,0.0,0.0,0.0,0.0,0.0,0.0,0.0,0.0,0.0,0.0,0.0,0.0,0.0,0.0,0.0,0.0,0.0,0.0,0.0,0.0
m39,ABBOTT,What do you mean?,0.0,0.0,0.0,0.0,0.0,0.0,0.0,0.0,0.0,0.0,0.0,0.0,0.0,0.0,0.0,0.0,0.0,0.0,0.0,0.0,0.0,0.0,0.0,0.0,0.0,0.0,0.0,0.0,0.0,0.0,0.0,0.0,0.0,0.0,0.0,0.0,0.0,0.0,0.0
m39,GRETKOV,Leaving was a business decision. We're both rich come enjoy it.,0.6269999999999999,0.871,0.0,0.94,0.0,0.0,0.0,0.0,0.0,0.0,0.296,0.0,0.0,0.0,0.0,0.0,0.0,0.0,0.0,0.0,0.0,0.0,0.0,0.0,0.0,0.0,0.0,0.0,0.0,0.0,0.0,0.0,0.0,0.0,0.0,0.0,0.0,0.0,0.0
m39,GRETKOV,One last push. One.,-0.805,0.0,0.0,0.0,0.0,0.0,0.0,0.0,0.0,0.0,0.0,-0.838,0.0,0.0,0.0,0.0,0.0,0.0,0.0,0.0,0.0,0.0,0.0,0.0,0.0,0.0,0.0,0.0,0.0,0.0,0.0,0.0,0.0,0.0,0.0,0.0,0.0,0.0,0.0
m39,ABBOTT,Neski was a roadblock. Without me there's no company no fortune. You owe me Uri. One last push.,-0.1506,0.871,0.0,0.0,0.0,0.0,0.0,0.0,0.0,0.0,0.0,-0.9125,0.0,-0.211,0.329,0.0,0.0,0.0,0.0,0.0,0.0,0.0,0.0,0.0,0.0,0.0,0.0,0.0,0.0,0.0,0.0,0.0,0.0,0.0,0.0,0.0,0.0,0.0,0.0
m39,GRETKOV,Anything else?,0.0,0.0,0.0,0.0,0.0,0.0,0.0,0.0,0.0,0.0,0.0,0.0,0.0,0.0,0.0,0.0,0.0,0.0,0.0,0.0,0.0,0.0,0.0,0.0,0.0,0.0,0.0,0.0,0.0,0.0,0.0,0.0,0.0,0.0,0.0,0.0,0.0,0.0,0.0
m39,ABBOTT,She's done everything I wanted. She bit on Conklin so fast it was laughable. She even found his bogus Swiss account...,0.05199999999999999,0.0,0.0,0.954,0.0,0.978,0.0,0.0,0.0,0.0,0.0,-0.8665,0.0,0.0,0.0,0.0,0.0,0.0,0.0,0.0,0.0,0.0,0.0,0.0,0.0,0.0,0.0,0.0,0.0,0.0,0.0,0.0,0.0,0.0,0.0,0.0,0.0,0.0,0.0
m39,GRETKOV,And the Landy woman?,0.205,0.0,0.0,0.0,0.0,0.0,0.0,0.0,0.0,0.0,0.0,0.0,0.0,0.0,0.265,0.0,0.0,0.0,0.0,0.0,0.0,0.0,0.0,0.0,0.0,0.0,0.0,0.0,0.0,0.0,0.0,0.0,0.0,0.0,0.0,0.0,0.0,0.0,0.0
m39,ABBOTT,No. The files are spotless. Whatever they find it's just going to make Conklin look worse.,-0.38425,0.0,0.0,0.953,0.0,0.0,0.0,0.0,0.0,-0.638,0.0,-0.96,0.0,0.0,0.0,0.0,0.0,0.0,0.0,0.0,0.0,0.0,0.0,0.0,0.0,0.0,0.0,0.0,0.0,0.0,0.0,0.0,0.0,0.0,0.0,0.0,0.0,0.0,0.0
m39,GRETKOV,Will it track back to us?,0.0,0.0,0.0,0.0,0.0,0.0,0.0,0.0,0.0,0.0,0.0,0.0,0.0,0.0,0.0,0.0,0.0,0.0,0.0,0.0,0.0,0.0,0.0,0.0,0.0,0.0,0.0,0.0,0.0,0.0,0.0,0.0,0.0,0.0,0.0,0.0,0.0,0.0,0.0
m39,ABBOTT,I'll say. You killed his goddam girlfriend instead. Now they're onto Neski. They're at the Brecker Hotel even as we speak.,-0.64175,0.0,0.0,0.0,0.0,0.0,0.0,-0.304,0.0,-0.873,0.0,0.0,0.0,0.0,0.0,0.0,-0.54,-0.988,0.0,0.0,0.0,0.0,0.0,0.0,0.0,0.0,0.0,0.0,0.0,0.0,0.0,0.0,0.0,0.0,0.0,0.0,0.0,0.0,0.0
m39,GRETKOV,There was a mistake.,-0.942,0.0,0.0,0.0,0.0,0.0,0.0,0.0,0.0,0.0,0.0,0.0,0.0,-0.942,0.0,0.0,0.0,0.0,0.0,0.0,0.0,0.0,0.0,0.0,0.0,0.0,0.0,0.0,0.0,0.0,0.0,0.0,0.0,0.0,0.0,0.0,0.0,0.0,0.0
m39,ABBOTT,You told me Bourne was dead.,-0.516,0.0,0.0,0.0,0.0,0.0,0.0,0.0,0.0,0.0,0.0,0.0,0.0,0.0,0.0,-0.565,0.0,0.0,0.0,0.0,0.0,0.0,0.0,0.0,0.0,0.0,0.0,0.0,0.0,0.0,0.0,0.0,0.0,0.0,0.0,0.0,0.0,0.0,0.0
m39,ABBOTT,Well you're probably right. I guess that's all that hubris is.,-0.16033333333333333,0.0,0.0,0.878,0.0,0.0,0.0,0.0,0.0,0.0,0.0,0.0,0.0,0.0,0.0,-0.503,0.0,-0.826,0.0,0.0,0.0,0.0,0.0,0.0,0.0,0.0,0.0,0.0,0.0,0.0,0.0,0.0,0.0,0.0,0.0,0.0,0.0,0.0,0.0
m39,PAMELA,No. You lost your way.,-0.843,0.0,0.0,0.0,0.0,0.0,0.0,0.0,0.0,0.0,0.0,-0.869,0.0,0.0,0.0,0.0,0.0,0.0,0.0,0.0,0.0,0.0,0.0,0.0,0.0,0.0,0.0,0.0,0.0,0.0,0.0,0.0,0.0,0.0,0.0,0.0,0.0,0.0,0.0
m39,ABBOTT,In the end honestly it's hubris. Simple hubris. You reach a point in this game when the only satisfaction left is to see how clever you are.,0.40066666666666667,0.917,0.0,0.9410000000000001,0.0,0.961,0.0,0.0,0.0,0.0,0.329,0.0,0.0,0.0,0.0,0.0,0.0,-0.826,0.493,0.923,0.0,0.0,0.0,0.0,0.0,0.0,0.0,0.0,0.0,0.0,0.0,0.0,0.0,0.0,0.0,0.0,0.0,0.0,0.0
m39,PAMELA,No good options left?,0.788,0.917,0.0,0.0,0.0,0.0,0.0,0.0,0.0,0.0,0.0,0.0,0.0,0.0,0.0,0.0,0.0,0.0,0.0,0.0,0.659,0.0,0.0,0.0,0.0,0.0,0.0,0.0,0.0,0.0,0.0,0.0,0.0,0.0,0.0,0.0,0.0,0.0,0.0
m39,ABBOTT,Had to be done.,0.0,0.0,0.0,0.0,0.0,0.0,0.0,0.0,0.0,0.0,0.0,0.0,0.0,0.0,0.0,0.0,0.0,0.0,0.0,0.0,0.0,0.0,0.0,0.0,0.0,0.0,0.0,0.0,0.0,0.0,0.0,0.0,0.0,0.0,0.0,0.0,0.0,0.0,0.0
m39,PAMELA,And Danny Zorn what was that?,0.0,0.0,0.0,0.0,0.0,0.0,0.0,0.0,0.0,0.0,0.0,0.0,0.0,0.0,0.0,0.0,0.0,0.0,0.0,0.0,0.0,0.0,0.0,0.0,0.0,0.0,0.0,0.0,0.0,0.0,0.0,0.0,0.0,0.0,0.0,0.0,0.0,0.0,0.0
m39,ABBOTT,Why not? It was just money.,0.148,0.0,0.0,0.0,0.0,0.0,0.0,0.0,0.0,0.0,0.0,0.0,0.0,0.0,0.204,0.0,0.0,0.0,0.0,0.0,0.0,0.0,0.0,0.0,0.0,0.0,0.0,0.0,0.0,0.0,0.0,0.0,0.0,0.0,0.0,0.0,0.0,0.0,0.0
m39,PAMELA,And pocketed a fair amount of change while doing it.,0.34275,0.9695,0.0,0.0,0.0,0.0,0.0,0.0,0.0,0.0,0.0,-0.826,0.0,0.0,0.0,0.0,0.0,0.0,0.0,0.0,0.0,0.329,0.0,0.0,0.0,0.0,0.0,0.0,0.0,0.0,0.0,0.0,0.0,0.0,0.0,0.0,0.0,0.0,0.0
m39,ABBOTT,I'm not a traitor. I've served my ountry.,-0.017500000000000016,0.0,0.0,0.96,0.0,0.0,0.0,0.0,0.0,0.0,0.0,0.0,0.0,-0.92,0.0,0.0,0.0,0.0,0.0,0.0,0.0,0.0,0.0,0.0,0.0,0.0,0.0,0.0,0.0,0.0,0.0,0.0,0.0,0.0,0.0,0.0,0.0,0.0,0.0
m39,PAMELA,'Why' would be enough for me.,0.0,0.0,0.0,0.0,0.0,0.0,0.0,0.0,0.0,0.0,0.0,0.0,0.0,0.0,0.0,0.0,0.0,0.0,0.0,0.0,0.0,0.0,0.0,0.0,0.0,0.0,0.0,0.0,0.0,0.0,0.0,0.0,0.0,0.0,0.0,0.0,0.0,0.0,0.0
m39,ABBOTT,I don't exactly know what to say -- I'm sorry.,0.10349999999999998,0.0,0.0,0.0,0.0,0.0,0.0,0.0,0.0,0.0,0.0,0.0,0.0,0.0,0.0,-0.843,0.0,0.0,0.0,0.928,0.0,0.0,0.0,0.0,0.0,0.0,0.0,0.0,0.0,0.0,0.0,0.0,0.0,0.0,0.0,0.0,0.0,0.0,0.0
m39,PAMELA,I'd rather stand if it's all the same to you.,0.8765000000000001,0.948,0.0,0.856,0.0,0.0,0.0,0.0,0.0,0.0,0.0,0.0,0.0,0.0,0.0,0.0,0.0,0.0,0.0,0.0,0.0,0.0,0.0,0.0,0.0,0.0,0.0,0.0,0.0,0.0,0.0,0.0,0.0,0.0,0.0,0.0,0.0,0.0,0.0
m39,ABBOTT,Sit down.,-0.79,0.0,0.0,0.0,0.0,0.0,0.0,0.0,0.0,0.0,0.0,0.0,0.0,0.0,0.0,0.0,0.0,-0.838,0.0,0.0,0.0,0.0,0.0,0.0,0.0,0.0,0.0,0.0,0.0,0.0,0.0,0.0,0.0,0.0,0.0,0.0,0.0,0.0,0.0
m39,PAMELA,I'm sorry Ward.,-0.6185,0.0,0.0,0.0,0.0,0.0,0.0,-0.608,0.0,0.0,0.0,0.0,0.0,0.0,0.0,-0.843,0.0,0.0,0.0,0.0,0.0,0.0,0.0,0.0,0.0,0.0,0.0,0.0,0.0,0.0,0.0,0.0,0.0,0.0,0.0,0.0,0.0,0.0,0.0
m39,ABBOTT,Jesus... I Zorn... I have to call his family. Tell them...,0.837,0.864,0.0,0.0,0.0,0.0,0.0,0.0,0.0,0.0,0.0,0.0,0.0,0.0,0.0,0.0,0.0,0.0,0.0,0.0,0.0,0.0,0.0,0.0,0.0,0.0,0.0,0.0,0.0,0.0,0.0,0.0,0.0,0.0,0.0,0.0,0.0,0.0,0.0
m39,PAMELA,Don't know.,0.0,0.0,0.0,0.0,0.0,0.0,0.0,0.0,0.0,0.0,0.0,0.0,0.0,0.0,0.0,0.0,0.0,0.0,0.0,0.0,0.0,0.0,0.0,0.0,0.0,0.0,0.0,0.0,0.0,0.0,0.0,0.0,0.0,0.0,0.0,0.0,0.0,0.0,0.0
m39,ABBOTT,Moscow? What the Hell's he going to Moscow for?,-0.846,0.0,0.0,0.0,0.0,0.0,0.0,-0.846,0.0,0.0,0.0,0.0,0.0,0.0,0.0,0.0,0.0,0.0,0.0,0.0,0.0,0.0,0.0,0.0,0.0,0.0,0.0,0.0,0.0,0.0,0.0,0.0,0.0,0.0,0.0,0.0,0.0,0.0,0.0
m39,ABBOTT,No... It must have been Bourne.,-0.234,0.0,0.0,0.0,0.0,0.0,0.0,0.0,0.0,0.0,0.0,0.0,0.0,-0.234,0.0,0.0,0.0,0.0,0.0,0.0,0.0,0.0,0.0,0.0,0.0,0.0,0.0,0.0,0.0,0.0,0.0,0.0,0.0,0.0,0.0,0.0,0.0,0.0,0.0
m39,PAMELA,Did he say anything to you?,0.0,0.0,0.0,0.0,0.0,0.0,0.0,0.0,0.0,0.0,0.0,0.0,0.0,0.0,0.0,0.0,0.0,0.0,0.0,0.0,0.0,0.0,0.0,0.0,0.0,0.0,0.0,0.0,0.0,0.0,0.0,0.0,0.0,0.0,0.0,0.0,0.0,0.0,0.0
m39,ABBOTT,Oh God... It must have been Bourne.,0.319,0.0,0.0,0.927,0.0,0.0,0.0,0.0,0.0,0.0,0.0,0.0,0.0,-0.234,0.0,0.0,0.0,0.0,0.0,0.0,0.0,0.0,0.0,0.0,0.0,0.0,0.0,0.0,0.0,0.0,0.0,0.0,0.0,0.0,0.0,0.0,0.0,0.0,0.0
m39,PAMELA,They found Danny Zorn's body. Dead in the basement at the building where my people got hit the first time.,-0.4016,0.0,0.0,0.954,0.0,0.0,0.0,-0.853,0.0,0.0,0.0,-0.872,0.0,0.0,0.0,-0.565,0.0,0.0,0.0,0.0,0.0,0.0,-0.747,0.0,0.0,0.0,0.0,0.0,0.0,0.0,0.0,0.0,0.0,0.0,0.0,0.0,0.0,0.0,0.0
m39,ABBOTT,What?,0.0,0.0,0.0,0.0,0.0,0.0,0.0,0.0,0.0,0.0,0.0,0.0,0.0,0.0,0.0,0.0,0.0,0.0,0.0,0.0,0.0,0.0,0.0,0.0,0.0,0.0,0.0,0.0,0.0,0.0,0.0,0.0,0.0,0.0,0.0,0.0,0.0,0.0,0.0
m39,ABBOTT,I wasn't sleeping.  You OK?,0.702,0.0,0.0,0.95,0.0,0.0,0.0,0.0,0.0,0.0,0.0,0.0,0.0,0.0,0.0,0.0,0.0,0.0,0.0,0.0,0.0,0.0,0.0,0.0,0.0,0.0,0.0,0.0,0.0,0.0,0.0,0.0,0.0,0.0,0.0,0.0,0.0,0.0,0.0
m39,PAMELA,Sorry to wake you.,-0.776,0.0,-0.923,0.0,0.0,0.0,0.0,0.0,0.0,0.0,0.0,0.0,0.0,0.0,0.0,-0.843,0.0,0.0,0.0,0.0,0.0,0.0,0.0,0.0,0.0,0.0,0.0,0.0,0.0,0.0,0.0,0.0,0.0,0.0,0.0,0.0,0.0,0.0,0.0
m39,PAMELA,Well whatever he's doing I've had enough -- this is now a search and destroy mission.  I want the Berlin police fully briefed and --  -- get this out to all the agencies.,-0.09455555555555557,0.986,-0.4205,0.9219999999999999,0.0,0.0,0.0,0.0,0.0,-0.867,0.0,-0.9079999999999999,0.0,0.0,0.0,0.0,0.0,0.0,0.0,0.942,0.0,0.0,0.0,0.0,0.0,0.0,0.0,0.0,0.0,0.0,0.0,0.0,0.0,0.0,0.0,0.0,0.0,0.0,0.0
m39,ABBOTT,It's hard to swallow.  The confusion -- the amnesia -- but he keeps on killing? It's more calculated than sick.  What about Nicky? She's the last one to see Bourne in Paris. She's the one he asks for. They disappear...,0.019555555555555548,0.9239999999999999,0.0,0.0,0.0,0.0,0.0,-0.291,-0.976,-0.329,0.0,0.0,0.0,0.0,0.0,-0.307,-0.54,0.0,0.0,0.0,0.659,0.245,0.0,0.0,0.0,0.0,0.0,0.0,0.0,0.0,0.0,0.0,0.0,0.0,0.0,0.0,0.0,0.0,0.0
m39,PAMELA,So what's he doing? You believe him?,0.05399999999999999,0.0,0.0,0.0,0.0,0.0,0.0,0.0,0.0,0.0,0.0,-0.826,0.0,0.0,0.0,0.0,0.0,0.0,0.0,0.914,0.0,0.0,0.0,0.0,0.0,0.0,0.0,0.0,0.0,0.0,0.0,0.0,0.0,0.0,0.0,0.0,0.0,0.0,0.0
m39,ABBOTT,There are no answers. There's either Jason Bourne alive or Jason Bourne dead. And I for one would prefer the latter. And what about her?  You just send her out to this lunatic with no protection?,-0.045666666666666654,0.0,0.0,0.0,0.0,0.0,0.508,0.0,0.0,0.0,0.0,-0.851,0.0,-0.224,0.176,-0.565,0.0,0.0,0.0,0.0,0.621,0.0,0.0,0.0,0.0,0.0,0.0,0.0,0.0,0.0,0.0,0.0,0.0,0.0,0.0,0.0,0.0,0.0,0.0
m39,PAMELA,Don't you want answers?,0.0,0.0,0.0,0.0,0.0,0.0,0.0,0.0,0.0,0.0,0.0,0.0,0.0,0.0,0.0,0.0,0.0,0.0,0.0,0.0,0.0,0.0,0.0,0.0,0.0,0.0,0.0,0.0,0.0,0.0,0.0,0.0,0.0,0.0,0.0,0.0,0.0,0.0,0.0
m39,ABBOTT,My ass he does. You're playing with fire Pamela. Marshall said nail him to the wall. I don't know how you interpreted that but I don't think he meant repatriate him.,-0.15016666666666664,0.892,0.0,0.0,0.0,0.0,0.659,0.0,0.0,0.0,0.0,0.0,0.0,-0.908,0.0,0.0,0.0,-0.9684999999999999,0.0,0.0,0.0,0.0,0.0,0.0,0.217,0.0,0.0,0.0,0.0,0.0,0.0,0.0,0.0,0.0,0.0,0.0,0.0,0.0,0.0
m39,PAMELA,Hold on -- he said he wants to come in.,-0.819,0.0,0.0,0.0,0.0,0.0,0.0,0.0,0.0,0.0,0.0,-0.885,0.0,0.0,0.0,0.0,0.0,0.0,0.0,0.0,0.0,0.0,0.0,0.0,0.0,0.0,0.0,0.0,0.0,0.0,0.0,0.0,0.0,0.0,0.0,0.0,0.0,0.0,0.0
m39,ABBOTT,Call a Mayday into Berlin station. We need snipers DOD whatever they got. Snipers?,-0.3366,0.0,-0.937,0.0,0.0,0.0,0.0,-0.212,0.0,0.0,0.0,-0.945,0.0,0.0,0.227,0.0,0.0,0.0,0.0,0.0,0.0,0.0,0.0,0.0,0.0,0.0,0.0,0.0,0.0,0.0,0.0,0.0,0.0,0.0,0.0,0.0,0.0,0.0,0.0
m39,PAMELA,And you do? From the moment he left Treadstone he has killed and eluded every person that you sent to find him...,-0.0625,0.917,0.0,0.0,0.0,0.0,0.0,0.0,0.0,0.0,0.219,-0.975,0.0,0.0,0.0,0.0,-0.54,0.0,0.0,0.0,0.0,0.0,0.0,0.0,0.0,0.0,0.0,0.0,0.0,0.0,0.0,0.0,0.0,0.0,0.0,0.0,0.0,0.0,0.0
m39,ABBOTT,You don't know what you're getting into here.,0.0,0.0,0.0,0.0,0.0,0.0,0.0,0.0,0.0,0.0,0.0,0.0,0.0,0.0,0.0,0.0,0.0,0.0,0.0,0.0,0.0,0.0,0.0,0.0,0.0,0.0,0.0,0.0,0.0,0.0,0.0,0.0,0.0,0.0,0.0,0.0,0.0,0.0,0.0
m39,PAMELA,I've already got a team there. I doubt Bourne's in Naples to settle down and raise a family.,0.12299999999999997,0.864,0.0,0.0,0.0,0.0,0.0,0.0,0.0,-0.329,0.0,0.0,0.0,0.0,0.0,0.0,0.0,-0.838,0.0,0.0,0.568,0.0,0.0,0.0,0.329,0.0,0.0,0.0,0.0,0.0,0.0,0.0,0.0,0.0,0.0,0.0,0.0,0.0,0.0
m39,ABBOTT,Berlin!,0.0,0.0,0.0,0.0,0.0,0.0,0.0,0.0,0.0,0.0,0.0,0.0,0.0,0.0,0.0,0.0,0.0,0.0,0.0,0.0,0.0,0.0,0.0,0.0,0.0,0.0,0.0,0.0,0.0,0.0,0.0,0.0,0.0,0.0,0.0,0.0,0.0,0.0,0.0
m39,ABBOTT,So what's your theory?  Conklin's reaching out from the grave to protect his good name?  The man is dead.,0.07620000000000002,0.0,0.0,0.987,0.0,0.0,0.0,0.0,0.0,0.0,0.0,-0.883,0.0,0.0,0.176,-0.565,0.0,0.0,0.0,0.0,0.659,0.0,0.0,0.0,0.0,0.0,0.0,0.0,0.0,0.0,0.0,0.0,0.0,0.0,0.0,0.0,0.0,0.0,0.0
m39,PAMELA,What's definitive is that I just lost two people in Berlin!,-0.843,0.0,0.0,0.0,0.0,0.0,0.0,0.0,0.0,0.0,0.0,-0.869,0.0,0.0,0.0,0.0,0.0,0.0,0.0,0.0,0.0,0.0,0.0,0.0,0.0,0.0,0.0,0.0,0.0,0.0,0.0,0.0,0.0,0.0,0.0,0.0,0.0,0.0,0.0
m39,ABBOTT,Conklin might've been a nut but he wasn't a mole. You have me his calendar for a couple of days I'll prove he killed Lincoln.  This is supposed to be definitive?,-0.2928571428571428,0.0,0.0,0.89,0.0,0.0,0.0,-0.869,0.0,-0.628,0.0,0.0,0.0,0.0,0.0,0.0,-0.54,-0.849,0.0,0.0,0.61,0.0,0.0,0.0,0.0,-0.884,0.0,0.0,0.0,0.0,0.0,0.0,0.0,0.0,0.0,0.0,0.0,0.0,0.0
m39,PAMELA,May I finish?,0.66,0.0,0.0,0.834,0.0,0.0,0.0,0.0,0.0,0.0,0.0,0.0,0.0,0.0,0.0,0.0,0.0,0.0,0.0,0.0,0.0,0.0,0.0,0.0,0.0,0.0,0.0,0.0,0.0,0.0,0.0,0.0,0.0,0.0,0.0,0.0,0.0,0.0,0.0
m39,ABBOTT,We were throwing money at him. Throwing it at him and asking him to keep it dark.,-0.4455,0.0,0.0,0.0,0.0,0.0,0.0,0.0,0.0,0.0,0.0,0.0,0.0,0.0,0.204,0.0,0.0,-0.913,0.0,0.0,0.0,0.0,0.0,0.0,0.0,-0.6,0.0,0.0,0.0,0.0,0.0,0.0,0.0,0.0,0.0,0.0,0.0,0.0,0.0
m39,PAMELA,Excuse me.,-0.824,0.0,0.0,0.0,0.0,0.0,0.0,0.0,0.0,0.0,0.0,-0.856,0.0,0.0,0.0,0.0,0.0,0.0,0.0,0.0,0.0,0.0,0.0,0.0,0.0,0.0,0.0,0.0,0.0,0.0,0.0,0.0,0.0,0.0,0.0,0.0,0.0,0.0,0.0
m39,ABBOTT,Do you know what his budget was?,0.82,0.0,0.0,0.862,0.0,0.0,0.0,0.0,0.0,0.0,0.0,0.0,0.0,0.0,0.0,0.0,0.0,0.0,0.0,0.0,0.0,0.0,0.0,0.0,0.0,0.0,0.0,0.0,0.0,0.0,0.0,0.0,0.0,0.0,0.0,0.0,0.0,0.0,0.0
m39,PAMELA,...At the time of his death Conklin was sitting on a personal account in the amount of seven-hundred and sixty thousand dollars.,0.005500000000000005,0.0,0.0,0.0,0.0,0.0,0.0,0.0,0.0,-0.908,0.0,0.0,0.0,0.0,0.0,0.0,0.0,0.0,0.0,0.919,0.0,0.0,0.0,0.0,0.0,0.0,0.0,0.0,0.0,0.0,0.0,0.0,0.0,0.0,0.0,0.0,0.0,0.0,0.0
m39,PAMELA,...this is Conklin's computer.,0.0,0.0,0.0,0.0,0.0,0.0,0.0,0.0,0.0,0.0,0.0,0.0,0.0,0.0,0.0,0.0,0.0,0.0,0.0,0.0,0.0,0.0,0.0,0.0,0.0,0.0,0.0,0.0,0.0,0.0,0.0,0.0,0.0,0.0,0.0,0.0,0.0,0.0,0.0
m39,PAMELA,...Ivan Mevedev -- senior financial manager -- worked for one of the new Russian petroleum companies Pecos Oil. He claimed to know where the money landed. We believe this could have only happened with help from someone inside the Agency... This...,0.44025,0.0,-0.325,0.9088,-0.847,0.0,0.659,0.0,0.0,0.0,0.0,0.0,0.0,0.0,0.204,0.0,0.0,0.0,0.0,0.914,0.648,0.0,0.0,0.0,0.0,0.0,0.0,0.0,0.0,0.0,0.0,0.0,0.0,0.0,0.0,0.0,0.0,0.0,0.0
m39,PAMELA,I think I do. We had a deal going down in Berlin last week. During the buy both our Field Agent and the seller were killed. We pulled a fingerprint from a timing charge that didn't go off.  They were killed by Jason Bourne.,0.06399999999999996,0.0,0.0,0.9095,0.0,0.0,0.0,0.0,0.0,0.0,0.284,-0.917,0.0,0.0,0.0,0.0,-0.54,-0.9165,0.0,0.0,0.646,0.0,0.0,0.0,0.204,0.0,0.0,0.0,0.0,0.0,0.0,0.0,0.0,0.0,0.0,0.0,0.0,0.0,0.0
m39,ABBOTT,Dead in a ditch? Drunk in a bar in Mogadishu? Who knows?,-0.653,0.0,-0.887,0.0,0.0,0.0,0.0,0.0,0.0,0.0,0.0,0.0,0.0,0.0,0.0,-0.5934999999999999,0.0,0.0,0.0,0.0,0.0,0.0,0.0,0.0,0.0,0.0,0.0,0.0,0.0,0.0,0.0,0.0,0.0,0.0,0.0,0.0,0.0,0.0,0.0
m39,PAMELA,And Bourne? Where's he now?,0.0,0.0,0.0,0.0,0.0,0.0,0.0,0.0,0.0,0.0,0.0,0.0,0.0,0.0,0.0,0.0,0.0,0.0,0.0,0.0,0.0,0.0,0.0,0.0,0.0,0.0,0.0,0.0,0.0,0.0,0.0,0.0,0.0,0.0,0.0,0.0,0.0,0.0,0.0
m39,ABBOTT,I've given thirty years and two marriages to this agency. I've shoveled shit on four continents. I'm due to retire next year and believe me I need my pension but if you think I'm gonna sit here and let you dangle me with this you can go to hell. Marshall too.  It had to be done.,-0.11641666666666667,0.0,0.0,0.904,0.0,0.0,0.0,-0.529,0.0,0.0,0.0,0.0,0.0,-0.24,0.243,-0.583,0.0,-0.9684999999999999,0.48,0.914,0.0,0.0,0.0,0.0,0.0,0.0,-0.906,0.0,0.0,0.0,0.0,0.0,0.0,0.0,0.0,0.0,0.0,0.0,0.0
m39,PAMELA,So you had Conklin killed.  I mean if we're cutting the crap...,-0.5515,0.0,0.0,0.0,0.0,0.0,0.0,0.0,0.0,0.0,0.0,0.0,0.0,-0.604,0.0,0.0,-0.54,0.0,0.0,0.0,0.0,0.0,0.0,0.0,0.0,0.0,0.0,0.0,0.0,0.0,0.0,0.0,0.0,0.0,0.0,0.0,0.0,0.0,0.0
m39,ABBOTT,What happened? Jason Bourne happened.  You've got the files? Then let's cut the crap. It went wrong. Conklin had these guys wound so tight they were bound to snap. Bourne was his number one -- guy went out to work screwed the op and never came back. Conklin couldn't fix it couldn't find Bourne couldn't adjust. It all went sideways. Finally there were no options left.,-0.029111111111111088,0.9313333333333333,0.0,0.865,-0.422,0.0,0.659,-0.21966666666666668,0.0,0.0,0.0,-0.6006666666666667,0.0,-0.7155,0.31,-0.538,0.0,0.0,0.0,0.0,0.0,0.0,0.0,0.0,0.263,0.0,0.0,-0.95,0.0,-0.52,0.0,0.0,0.0,0.0,0.0,0.0,0.0,0.0,0.0
m39,PAMELA,I want to know what happened.,0.659,0.0,0.0,0.0,0.0,0.0,0.659,0.0,0.0,0.0,0.0,0.0,0.0,0.0,0.0,0.0,0.0,0.0,0.0,0.0,0.0,0.0,0.0,0.0,0.0,0.0,0.0,0.0,0.0,0.0,0.0,0.0,0.0,0.0,0.0,0.0,0.0,0.0,0.0
m39,ABBOTT,What are you after Pam? You want to fry me? You want my desk? Is that it?,0.0,0.0,0.0,0.0,0.0,0.0,0.0,0.0,0.0,0.0,0.0,0.0,0.0,0.0,0.0,0.0,0.0,0.0,0.0,0.0,0.0,0.0,0.0,0.0,0.0,0.0,0.0,0.0,0.0,0.0,0.0,0.0,0.0,0.0,0.0,0.0,0.0,0.0,0.0
m39,PAMELA,Let's talk about Conklin.,-0.9,0.0,0.0,0.0,0.0,0.0,0.0,0.0,0.0,0.0,0.0,-0.993,0.0,0.0,0.0,0.0,0.0,0.0,0.0,0.0,0.0,0.0,0.0,0.0,0.0,0.0,0.0,0.0,0.0,0.0,0.0,0.0,0.0,0.0,0.0,0.0,0.0,0.0,0.0
m39,PAMELA,He does. I've been down to the archives. I have the files Ward.,-0.17766666666666667,0.922,0.0,0.0,0.0,0.0,0.0,-0.608,0.0,0.0,0.0,0.0,0.0,0.0,0.0,0.0,0.0,-0.838,0.0,0.0,0.0,0.0,0.0,0.0,0.0,0.0,0.0,0.0,0.0,0.0,0.0,0.0,0.0,0.0,0.0,0.0,0.0,0.0,0.0
m39,ABBOTT,To know about it?  It was a kill squad. Black on black. Closed down two years ago. Nobody wants to know about Treadstone. Not around here.  You better take this back to Marty and make sure he knows what you're doing.,-0.09418181818181823,0.86,0.0,0.9195,0.0,0.872,0.0,0.0,0.0,0.0,0.0,-0.413,0.0,-0.986,0.0,0.0,-0.54,-0.91,0.0,0.0,0.0,0.329,0.0,0.0,0.0,0.0,0.0,0.0,0.0,0.0,0.0,0.0,0.0,0.0,0.0,0.0,0.0,0.0,0.0
m39,PAMELA,I want to know about Treadstone.,0.0,0.0,0.0,0.0,0.0,0.0,0.0,0.0,0.0,0.0,0.0,0.0,0.0,0.0,0.0,0.0,0.0,0.0,0.0,0.0,0.0,0.0,0.0,0.0,0.0,0.0,0.0,0.0,0.0,0.0,0.0,0.0,0.0,0.0,0.0,0.0,0.0,0.0,0.0
m39,ABBOTT,And what are we looking for?,0.0,0.0,0.0,0.0,0.0,0.0,0.0,0.0,0.0,0.0,0.0,0.0,0.0,0.0,0.0,0.0,0.0,0.0,0.0,0.0,0.0,0.0,0.0,0.0,0.0,0.0,0.0,0.0,0.0,0.0,0.0,0.0,0.0,0.0,0.0,0.0,0.0,0.0,0.0
m39,ABBOTT,With all due respect Pam I think you might've wandered a little past your pay-grade.,-0.1182,0.0,-0.16,0.89,0.0,0.0,0.0,0.0,0.0,0.0,0.0,0.0,0.0,0.0,0.0,0.0,0.0,-0.9595,0.0,0.0,0.659,0.0,0.0,0.0,0.0,0.0,0.0,0.0,0.0,0.0,0.0,0.0,0.0,0.0,0.0,0.0,0.0,0.0,0.0
m39,PAMELA,That's not gonna fly.,0.0,0.0,0.0,0.0,0.0,0.0,0.0,0.0,0.0,0.0,0.0,0.0,0.0,0.0,0.0,0.0,0.0,0.0,0.0,0.0,0.0,0.0,0.0,0.0,0.0,0.0,0.0,0.0,0.0,0.0,0.0,0.0,0.0,0.0,0.0,0.0,0.0,0.0,0.0
m39,ABBOTT,Never heard of it.,0.0,0.0,0.0,0.0,0.0,0.0,0.0,0.0,0.0,0.0,0.0,0.0,0.0,0.0,0.0,0.0,0.0,0.0,0.0,0.0,0.0,0.0,0.0,0.0,0.0,0.0,0.0,0.0,0.0,0.0,0.0,0.0,0.0,0.0,0.0,0.0,0.0,0.0,0.0
m39,PAMELA,Treadstone.,0.0,0.0,0.0,0.0,0.0,0.0,0.0,0.0,0.0,0.0,0.0,0.0,0.0,0.0,0.0,0.0,0.0,0.0,0.0,0.0,0.0,0.0,0.0,0.0,0.0,0.0,0.0,0.0,0.0,0.0,0.0,0.0,0.0,0.0,0.0,0.0,0.0,0.0,0.0
m39,ZORN,Okay... ,0.198,0.0,0.0,0.0,0.0,0.0,0.0,0.0,0.0,0.0,0.0,0.0,0.0,0.0,0.198,0.0,0.0,0.0,0.0,0.0,0.0,0.0,0.0,0.0,0.0,0.0,0.0,0.0,0.0,0.0,0.0,0.0,0.0,0.0,0.0,0.0,0.0,0.0,0.0
m39,ABBOTT,Show me again...,0.08099999999999996,0.965,0.0,0.0,0.0,0.0,0.0,0.0,0.0,0.0,0.0,0.0,0.0,0.0,0.0,0.0,0.0,-0.854,0.0,0.0,0.0,0.0,0.0,0.0,0.0,0.0,0.0,0.0,0.0,0.0,0.0,0.0,0.0,0.0,0.0,0.0,0.0,0.0,0.0
m39,ZORN,Nobody. You.  I had to tell you right?,-0.736,0.0,0.0,0.0,0.0,0.0,0.0,0.0,0.0,0.0,0.0,0.0,0.0,-0.986,0.0,-0.503,0.0,0.0,0.0,0.0,0.0,0.0,0.0,0.0,0.0,0.0,0.0,0.0,0.0,0.0,0.0,0.0,0.0,0.0,0.0,0.0,0.0,0.0,0.0
m39,ABBOTT,Who else knows about this?,0.0,0.0,0.0,0.0,0.0,0.0,0.0,0.0,0.0,0.0,0.0,0.0,0.0,0.0,0.0,0.0,0.0,0.0,0.0,0.0,0.0,0.0,0.0,0.0,0.0,0.0,0.0,0.0,0.0,0.0,0.0,0.0,0.0,0.0,0.0,0.0,0.0,0.0,0.0
m39,ZORN,Including Landy...  She had access to the archives.,0.52825,0.922,0.0,0.909,0.0,0.0,0.0,0.0,0.0,0.0,0.0,0.0,0.0,0.0,0.26,0.0,0.0,0.0,0.0,0.0,0.0,0.0,0.0,0.0,0.0,0.0,0.0,0.0,0.0,0.0,0.0,0.0,0.0,0.0,0.0,0.0,0.0,0.0,0.0
m39,ABBOTT,Lots of people...,0.0,0.0,0.0,0.0,0.0,0.0,0.0,0.0,0.0,0.0,0.0,0.0,0.0,0.0,0.0,0.0,0.0,0.0,0.0,0.0,0.0,0.0,0.0,0.0,0.0,0.0,0.0,0.0,0.0,0.0,0.0,0.0,0.0,0.0,0.0,0.0,0.0,0.0,0.0
m39,ZORN,Something's been going on here in Europe. And it's still going on. Post Conklin. Who's been in Berlin?,-0.03249999999999997,0.0,0.0,0.825,0.0,0.0,0.0,0.0,0.0,0.0,0.0,-0.934,0.0,0.0,0.0,0.0,0.0,0.0,0.0,0.0,0.0,0.0,0.0,0.0,0.0,0.0,0.0,0.0,0.0,0.0,0.0,0.0,0.0,0.0,0.0,0.0,0.0,0.0,0.0
m39,ABBOTT,Keep going...,0.0,0.0,0.0,0.0,0.0,0.0,0.0,0.0,0.0,0.0,0.0,0.0,0.0,0.0,0.0,0.0,0.0,0.0,0.0,0.0,0.0,0.0,0.0,0.0,0.0,0.0,0.0,0.0,0.0,0.0,0.0,0.0,0.0,0.0,0.0,0.0,0.0,0.0,0.0
m39,ZORN,Okay. What if someone decided to cover their tracks by blaming Conklin and Bourne. What if Bourne didn't have anything to do with this?,-0.03225,0.0,0.0,0.0,0.0,0.0,0.0,0.0,0.0,0.0,0.18,0.0,0.0,-0.659,0.21350000000000002,0.0,0.0,0.0,0.0,0.0,0.0,0.0,0.0,0.0,0.0,0.0,0.0,0.0,0.0,0.0,0.0,0.0,0.0,0.0,0.0,0.0,0.0,0.0,0.0
m39,ABBOTT,Jesus...,0.0,0.0,0.0,0.0,0.0,0.0,0.0,0.0,0.0,0.0,0.0,0.0,0.0,0.0,0.0,0.0,0.0,0.0,0.0,0.0,0.0,0.0,0.0,0.0,0.0,0.0,0.0,0.0,0.0,0.0,0.0,0.0,0.0,0.0,0.0,0.0,0.0,0.0,0.0
m39,ZORN,Is it a slam dunk? No but...,-0.98,0.0,0.0,0.0,0.0,0.0,0.0,-0.98,0.0,0.0,0.0,0.0,0.0,0.0,0.0,0.0,0.0,0.0,0.0,0.0,0.0,0.0,0.0,0.0,0.0,0.0,0.0,0.0,0.0,0.0,0.0,0.0,0.0,0.0,0.0,0.0,0.0,0.0,0.0
m39,ABBOTT,It was staged?,-0.869,0.0,0.0,0.0,0.0,0.0,0.0,0.0,0.0,0.0,0.0,-0.99,0.0,0.0,0.0,0.0,0.0,0.0,0.0,0.0,0.0,0.0,0.0,0.0,0.0,0.0,0.0,0.0,0.0,0.0,0.0,0.0,0.0,0.0,0.0,0.0,0.0,0.0,0.0
m39,ZORN,There were two charges they were supposed to go off simultaneously. The second one the one that didn't go off was down here...  First of all this is nothing it's a sub-line for the breaker above. Second why put the charge all the way down here? If you're good enough to get in here and handle the gear you're good enough to know you don't need this.  Bourne would know.,0.10675,0.0,0.0,0.91525,0.0,0.0,0.0,-0.212,0.0,0.0,0.0,0.0,0.0,-0.311,0.0,0.0,0.0,-0.838,0.0,0.0,0.659,0.0,0.0,0.0,0.0,-0.884,0.0,0.0,-0.599,0.0,0.0,0.0,0.0,0.0,0.0,0.0,0.0,0.0,0.0
m39,ABBOTT,And?,0.0,0.0,0.0,0.0,0.0,0.0,0.0,0.0,0.0,0.0,0.0,0.0,0.0,0.0,0.0,0.0,0.0,0.0,0.0,0.0,0.0,0.0,0.0,0.0,0.0,0.0,0.0,0.0,0.0,0.0,0.0,0.0,0.0,0.0,0.0,0.0,0.0,0.0,0.0
m39,ZORN,You put a four-gam Kel on here and it's gonna take out power to the building. You know that. What you can't know is if it's gonna blow the room with it.,-0.16549999999999998,0.0,0.0,0.0,0.0,0.0,0.0,-0.99,0.0,0.0,0.0,0.0,0.0,0.0,0.0,0.0,0.0,0.0,0.0,0.0,0.659,0.0,0.0,0.0,0.0,0.0,0.0,0.0,0.0,0.0,0.0,0.0,0.0,0.0,0.0,0.0,0.0,0.0,0.0
m39,ABBOTT,What do you have Danny?,0.0,0.0,0.0,0.0,0.0,0.0,0.0,0.0,0.0,0.0,0.0,0.0,0.0,0.0,0.0,0.0,0.0,0.0,0.0,0.0,0.0,0.0,0.0,0.0,0.0,0.0,0.0,0.0,0.0,0.0,0.0,0.0,0.0,0.0,0.0,0.0,0.0,0.0,0.0
m39,ZORN,I did my box work but I wanted to show you before I showed Landy. I came out here last night because none of this was making any sense. I mean I'm with you on this Conklin was a nut but a traitor? I just can't get there.,-0.4033333333333333,0.0,0.0,0.825,0.0,0.0,0.0,0.0,0.0,0.0,0.0,-0.497,0.0,-0.92,0.265,0.0,0.0,-0.854,0.0,0.0,0.0,0.0,0.0,0.0,0.0,0.0,0.0,0.0,0.0,0.0,0.0,0.0,0.0,0.0,0.0,0.0,0.0,0.0,0.0
m39,ZORN,The sooner the better.,0.872,0.0,0.0,0.0,0.0,0.872,0.0,0.0,0.0,0.0,0.0,0.0,0.0,0.0,0.0,0.0,0.0,0.0,0.0,0.0,0.0,0.0,0.0,0.0,0.0,0.0,0.0,0.0,0.0,0.0,0.0,0.0,0.0,0.0,0.0,0.0,0.0,0.0,0.0
m39,ABBOTT,She say what time I should call?,-0.83,0.0,0.0,0.0,0.0,0.0,0.0,0.0,0.0,0.0,0.0,0.0,0.0,0.0,0.0,0.0,0.0,-0.856,0.0,0.0,0.0,0.0,0.0,0.0,0.0,0.0,0.0,0.0,0.0,0.0,0.0,0.0,0.0,0.0,0.0,0.0,0.0,0.0,0.0
m39,ABBOTT,Thanks.,0.329,0.0,0.0,0.0,0.0,0.0,0.0,0.0,0.0,0.0,0.0,0.0,0.0,0.0,0.0,0.0,0.0,0.0,0.0,0.0,0.0,0.329,0.0,0.0,0.0,0.0,0.0,0.0,0.0,0.0,0.0,0.0,0.0,0.0,0.0,0.0,0.0,0.0,0.0
m39,ZORN,Sir...,0.845,0.0,0.0,0.867,0.0,0.0,0.0,0.0,0.0,0.0,0.0,0.0,0.0,0.0,0.0,0.0,0.0,0.0,0.0,0.0,0.0,0.0,0.0,0.0,0.0,0.0,0.0,0.0,0.0,0.0,0.0,0.0,0.0,0.0,0.0,0.0,0.0,0.0,0.0
m39,BOURNE,I'm sorry.,-0.629,0.0,0.0,0.0,0.0,0.0,0.0,0.0,0.0,0.0,0.0,0.0,0.0,0.0,0.0,-0.843,0.0,0.0,0.0,0.0,0.0,0.0,0.0,0.0,0.0,0.0,0.0,0.0,0.0,0.0,0.0,0.0,0.0,0.0,0.0,0.0,0.0,0.0,0.0
